<?xml version="1.0" encoding="UTF-8"?>

<!ELEMENT opt (defaults?,slide+)>

<!ELEMENT defaults (title, (background|bullet|transition)+)>

<!ELEMENT slide (title, (bullet|img|transition)+)>

<!ELEMENT title (#PCDATA)>
<!ATTLIST title
          color CDATA #IMPLIED
          font CDATA #IMPLIED
>

<!ELEMENT background (#PCDATA)>
<!ATTLIST background
          src CDATA #REQUIRED
>

<!ELEMENT bullet (#PCDATA)>
<!ATTLIST bullet
          color CDATA #IMPLIED
          font CDATA #IMPLIED
          symbol (none) #IMPLIED
>

<!ELEMENT img (#PCDATA)>
<!ATTLIST img
          src CDATA #REQUIRED
>

<!ELEMENT transition (#PCDATA)>
<!ATTLIST transition
          style (cube|flip|yzflip|fade) #REQUIRED
>

